,index,menu_id,place,occasion,date,location,page_count,dish_count,dish_name,dish_id,menu_item_id,menu_page_id,menus_appeared,times_appeared,first_appeared,last_appeared,lowest_price,highest_price,price_x,high_price,tokenized_desc,no_stopwords,pos_desc,desc_len,desc_all_len,cleaned_text,clean_text,decade,avg_price_at_restaurant
48,982720,28373,,,1958-03-04,The Dining Room,7,210,"sea food dinner- tomato juice cocktail,  hearts of celery, olives, fried  oysters, fish, scallops, shrimp, crabflake, french fried potatoes, green asparagus, bread and butter, coffee or tea, fresh fruit  sherbert",443369.0,654773,52390,1,1,1958,1958,3.0,3.0,3.0,,"['sea', 'food', 'dinner-', 'tomato', 'juice', 'cocktail,', 'hearts', 'of', 'celery,', 'olives,', 'fried', 'oysters,', 'fish,', 'scallops,', 'shrimp,', 'crabflake,', 'french', 'fried', 'potatoes,', 'green', 'asparagus,', 'bread', 'and', 'butter,', 'coffee', 'or', 'tea,', 'fresh', 'fruit', 'sherbert']","['sea', 'food', 'dinner-', 'tomato', 'juice', 'cocktail,', 'hearts', 'celery,', 'olives,', 'fried', 'oysters,', 'fish,', 'scallops,', 'shrimp,', 'crabflake,', 'french', 'fried', 'potatoes,', 'green', 'asparagus,', 'bread', 'butter,', 'coffee', 'tea,', 'fresh', 'fruit', 'sherbert']","[('sea', 'NN'), ('food', 'NN'), ('dinner-', 'JJ'), ('tomato', 'NN'), ('juice', 'NN'), ('cocktail,', 'NN'), ('hearts', 'NNS'), ('celery,', 'VBP'), ('olives,', 'RB'), ('fried', 'VBN'), ('oysters,', 'JJ'), ('fish,', 'NN'), ('scallops,', 'NN'), ('shrimp,', 'NN'), ('crabflake,', 'NN'), ('french', 'JJ'), ('fried', 'VBN'), ('potatoes,', 'NN'), ('green', 'JJ'), ('asparagus,', 'NN'), ('bread', 'NN'), ('butter,', 'NN'), ('coffee', 'NN'), ('tea,', 'NN'), ('fresh', 'JJ'), ('fruit', 'NN'), ('sherbert', 'NN')]",27.0,30.0,"'sea', 'food', 'dinner-', 'tomato', 'juice', 'cocktail,', 'hearts', 'celery,', 'olives,', 'fried', 'oysters,', 'fish,', 'scallops,', 'shrimp,', 'crabflake,', 'french', 'fried', 'potatoes,', 'green', 'asparagus,', 'bread', 'butter,', 'coffee', 'tea,', 'fresh', 'fruit', 'sherbert'",sea food dinner tomato juice cocktail hearts celery olives fried oysters fish scallops shrimp crabflake french fried potatoes green asparagus bread butter coffee tea fresh fruit sherbert,1950,3.0
49,983517,28380,,,1958-04-10,Clark's Restaurant,5,71,"grilled smoked ham steak, cherry sauce, french fried potatoes, tossed garden salad served with clark's fresh-baked roll or muffin",352750.0,652731,52437,1,1,1958,1958,1.55,2.1,1.55,2.1,"['grilled', 'smoked', 'ham', 'steak,', 'cherry', 'sauce,', 'french', 'fried', 'potatoes,', 'tossed', 'garden', 'salad', 'served', 'with', ""clark's"", 'fresh-baked', 'roll', 'or', 'muffin']","['grilled', 'smoked', 'ham', 'steak,', 'cherry', 'sauce,', 'french', 'fried', 'potatoes,', 'tossed', 'garden', 'salad', 'served', ""clark's"", 'fresh-baked', 'roll', 'muffin']","[('grilled', 'VBN'), ('smoked', 'VBD'), ('ham', 'JJ'), ('steak,', 'NN'), ('cherry', 'NN'), ('sauce,', 'VBD'), ('french', 'JJ'), ('fried', 'VBN'), ('potatoes,', 'NN'), ('tossed', 'VBN'), ('garden', 'NN'), ('salad', 'NN'), ('served', 'VBD'), (""clark's"", 'JJ'), ('fresh-baked', 'JJ'), ('roll', 'NN'), ('muffin', 'NN')]",17.0,19.0,"'grilled', 'smoked', 'ham', 'steak,', 'cherry', 'sauce,', 'french', 'fried', 'potatoes,', 'tossed', 'garden', 'salad', 'served', 'clark's', 'fresh-baked', 'roll', 'muffin'",grilled smoked ham steak cherry sauce french fried potatoes tossed garden salad served clarks freshbaked roll muffin,1950,1.4666666666666668
50,983521,28380,,,1958-04-10,Clark's Restaurant,5,71,"baked chicken cutlet, fricasse gravy, cranberry sauce, french fried potatoes, tossed garden salad served with clark's fresh-baked roll or muffin",352754.0,652737,52437,1,1,1958,1958,0.0,0.0,1.35,1.9,"['baked', 'chicken', 'cutlet,', 'fricasse', 'gravy,', 'cranberry', 'sauce,', 'french', 'fried', 'potatoes,', 'tossed', 'garden', 'salad', 'served', 'with', ""clark's"", 'fresh-baked', 'roll', 'or', 'muffin']","['baked', 'chicken', 'cutlet,', 'fricasse', 'gravy,', 'cranberry', 'sauce,', 'french', 'fried', 'potatoes,', 'tossed', 'garden', 'salad', 'served', ""clark's"", 'fresh-baked', 'roll', 'muffin']","[('baked', 'VBN'), ('chicken', 'JJ'), ('cutlet,', 'NN'), ('fricasse', 'NN'), ('gravy,', 'NN'), ('cranberry', 'NN'), ('sauce,', 'VBD'), ('french', 'JJ'), ('fried', 'VBN'), ('potatoes,', 'NN'), ('tossed', 'VBN'), ('garden', 'NN'), ('salad', 'NN'), ('served', 'VBD'), (""clark's"", 'JJ'), ('fresh-baked', 'JJ'), ('roll', 'NN'), ('muffin', 'NN')]",18.0,20.0,"'baked', 'chicken', 'cutlet,', 'fricasse', 'gravy,', 'cranberry', 'sauce,', 'french', 'fried', 'potatoes,', 'tossed', 'garden', 'salad', 'served', 'clark's', 'fresh-baked', 'roll', 'muffin'",baked chicken cutlet fricasse gravy cranberry sauce french fried potatoes tossed garden salad served clarks freshbaked roll muffin,1950,1.4666666666666668
51,983523,28380,,,1958-04-10,Clark's Restaurant,5,71,"broiled salmon steak, lemon butter, french fried potatoes, pickled beet and egg salad served with clark's fresh-baked roll or muffin",352756.0,652739,52437,1,1,1958,1958,0.0,0.0,1.5,2.05,"['broiled', 'salmon', 'steak,', 'lemon', 'butter,', 'french', 'fried', 'potatoes,', 'pickled', 'beet', 'and', 'egg', 'salad', 'served', 'with', ""clark's"", 'fresh-baked', 'roll', 'or', 'muffin']","['broiled', 'salmon', 'steak,', 'lemon', 'butter,', 'french', 'fried', 'potatoes,', 'pickled', 'beet', 'egg', 'salad', 'served', ""clark's"", 'fresh-baked', 'roll', 'muffin']","[('broiled', 'VBN'), ('salmon', 'JJ'), ('steak,', 'NN'), ('lemon', 'NN'), ('butter,', 'NN'), ('french', 'JJ'), ('fried', 'VBN'), ('potatoes,', 'NN'), ('pickled', 'VBN'), ('beet', 'NN'), ('egg', 'NN'), ('salad', 'NN'), ('served', 'VBD'), (""clark's"", 'JJ'), ('fresh-baked', 'JJ'), ('roll', 'NN'), ('muffin', 'NN')]",17.0,20.0,"'broiled', 'salmon', 'steak,', 'lemon', 'butter,', 'french', 'fried', 'potatoes,', 'pickled', 'beet', 'egg', 'salad', 'served', 'clark's', 'fresh-baked', 'roll', 'muffin'",broiled salmon steak lemon butter french fried potatoes pickled beet egg salad served clarks freshbaked roll muffin,1950,1.4666666666666668
52,985349,28407,,,1958-09-01,The Riverview,5,163,"lobster stew, steamed or fried clams, clam bouillon whole medium lobster (boiled, baked or broiled) drawn butter, fr. fr. potatoes, hot rolls and butter, tea or coffee, dessert",242535.0,655211,52539,1,1,1958,1958,0.0,0.0,4.75,,"['lobster', 'stew,', 'steamed', 'or', 'fried', 'clams,', 'clam', 'bouillon', 'whole', 'medium', 'lobster', '(boiled,', 'baked', 'or', 'broiled)', 'drawn', 'butter,', 'fr.', 'fr.', 'potatoes,', 'hot', 'rolls', 'and', 'butter,', 'tea', 'or', 'coffee,', 'dessert']","['lobster', 'stew,', 'steamed', 'fried', 'clams,', 'clam', 'bouillon', 'whole', 'medium', 'lobster', '(boiled,', 'baked', 'broiled)', 'drawn', 'butter,', 'fr.', 'fr.', 'potatoes,', 'hot', 'rolls', 'butter,', 'tea', 'coffee,', 'dessert']","[('lobster', 'NN'), ('stew,', 'NN'), ('steamed', 'VBD'), ('fried', 'JJ'), ('clams,', 'NN'), ('clam', 'NN'), ('bouillon', 'NN'), ('whole', 'JJ'), ('medium', 'NN'), ('lobster', 'NN'), ('(boiled,', 'NNP'), ('baked', 'VBD'), ('broiled)', 'JJ'), ('drawn', 'NN'), ('butter,', 'NN'), ('fr.', 'NN'), ('fr.', 'JJ'), ('potatoes,', 'NN'), ('hot', 'JJ'), ('rolls', 'NNS'), ('butter,', 'VBP'), ('tea', 'JJ'), ('coffee,', 'NN'), ('dessert', 'NN')]",24.0,28.0,"'lobster', 'stew,', 'steamed', 'fried', 'clams,', 'clam', 'bouillon', 'whole', 'medium', 'lobster', '(boiled,', 'baked', 'broiled)', 'drawn', 'butter,', 'fr.', 'fr.', 'potatoes,', 'hot', 'rolls', 'butter,', 'tea', 'coffee,', 'dessert'",lobster stew steamed fried clams clam bouillon whole medium lobster boiled baked broiled drawn butter fr fr potatoes hot rolls butter tea coffee dessert,1950,4.75
53,985436,28408,,,1958-09-18,Chickland,4,94,"barbecue special: fruit cup, tomato juice or soup, barbecued chicken, french fried potatoes, cole slaw, home-made rolls and butter, ice cream, pudding, or jello, tea or coffee",324355.0,650687,52545,1,1,1958,1958,0.0,0.0,1.7,,"['barbecue', 'special:', 'fruit', 'cup,', 'tomato', 'juice', 'or', 'soup,', 'barbecued', 'chicken,', 'french', 'fried', 'potatoes,', 'cole', 'slaw,', 'home-made', 'rolls', 'and', 'butter,', 'ice', 'cream,', 'pudding,', 'or', 'jello,', 'tea', 'or', 'coffee']","['barbecue', 'special:', 'fruit', 'cup,', 'tomato', 'juice', 'soup,', 'barbecued', 'chicken,', 'french', 'fried', 'potatoes,', 'cole', 'slaw,', 'home-made', 'rolls', 'butter,', 'ice', 'cream,', 'pudding,', 'jello,', 'tea', 'coffee']","[('barbecue', 'NN'), ('special:', 'NN'), ('fruit', 'NN'), ('cup,', 'NN'), ('tomato', 'NN'), ('juice', 'NN'), ('soup,', 'NN'), ('barbecued', 'VBN'), ('chicken,', 'JJ'), ('french', 'JJ'), ('fried', 'VBN'), ('potatoes,', 'JJ'), ('cole', 'JJ'), ('slaw,', 'NN'), ('home-made', 'NN'), ('rolls', 'NNS'), ('butter,', 'JJ'), ('ice', 'NN'), ('cream,', 'NN'), ('pudding,', 'NN'), ('jello,', 'NN'), ('tea', 'NN'), ('coffee', 'NN')]",23.0,27.0,"'barbecue', 'special:', 'fruit', 'cup,', 'tomato', 'juice', 'soup,', 'barbecued', 'chicken,', 'french', 'fried', 'potatoes,', 'cole', 'slaw,', 'home-made', 'rolls', 'butter,', 'ice', 'cream,', 'pudding,', 'jello,', 'tea', 'coffee'",barbecue special fruit cup tomato juice soup barbecued chicken french fried potatoes cole slaw homemade rolls butter ice cream pudding jello tea coffee,1950,2.225
54,985437,28408,,,1958-09-18,Chickland,4,94,"fried special: fruit cup, tomato juice or soup, southern fried chicken, brown gravy, french fried potatoes, cole slaw, home-made rolls and butter, ice cream, pudding or jello, tea or coffee",239989.0,650689,52545,1,1,1958,1958,0.0,0.0,1.7,,"['fried', 'special:', 'fruit', 'cup,', 'tomato', 'juice', 'or', 'soup,', 'southern', 'fried', 'chicken,', 'brown', 'gravy,', 'french', 'fried', 'potatoes,', 'cole', 'slaw,', 'home-made', 'rolls', 'and', 'butter,', 'ice', 'cream,', 'pudding', 'or', 'jello,', 'tea', 'or', 'coffee']","['fried', 'special:', 'fruit', 'cup,', 'tomato', 'juice', 'soup,', 'southern', 'fried', 'chicken,', 'brown', 'gravy,', 'french', 'fried', 'potatoes,', 'cole', 'slaw,', 'home-made', 'rolls', 'butter,', 'ice', 'cream,', 'pudding', 'jello,', 'tea', 'coffee']","[('fried', 'VBN'), ('special:', 'JJ'), ('fruit', 'NN'), ('cup,', 'NN'), ('tomato', 'NN'), ('juice', 'NN'), ('soup,', 'NN'), ('southern', 'JJ'), ('fried', 'VBN'), ('chicken,', 'NN'), ('brown', 'JJ'), ('gravy,', 'NN'), ('french', 'JJ'), ('fried', 'VBN'), ('potatoes,', 'JJ'), ('cole', 'JJ'), ('slaw,', 'NN'), ('home-made', 'NN'), ('rolls', 'NNS'), ('butter,', 'JJ'), ('ice', 'NN'), ('cream,', 'NN'), ('pudding', 'VBG'), ('jello,', 'NN'), ('tea', 'NN'), ('coffee', 'NN')]",26.0,30.0,"'fried', 'special:', 'fruit', 'cup,', 'tomato', 'juice', 'soup,', 'southern', 'fried', 'chicken,', 'brown', 'gravy,', 'french', 'fried', 'potatoes,', 'cole', 'slaw,', 'home-made', 'rolls', 'butter,', 'ice', 'cream,', 'pudding', 'jello,', 'tea', 'coffee'",fried special fruit cup tomato juice soup southern fried chicken brown gravy french fried potatoes cole slaw homemade rolls butter ice cream pudding jello tea coffee,1950,2.225
55,985443,28408,,,1958-09-18,Chickland,4,94,"general lee special: fruit cup, tomato juice or soup, half southern fried chicken, brown gravy, french fried potatoes, cole slaw, home-made rolls and butter, pudding, ice cream or jello, a cup of delicious coffee",324356.0,650699,52545,1,1,1958,1958,2.5,2.5,2.5,,"['general', 'lee', 'special:', 'fruit', 'cup,', 'tomato', 'juice', 'or', 'soup,', 'half', 'southern', 'fried', 'chicken,', 'brown', 'gravy,', 'french', 'fried', 'potatoes,', 'cole', 'slaw,', 'home-made', 'rolls', 'and', 'butter,', 'pudding,', 'ice', 'cream', 'or', 'jello,', 'a', 'cup', 'of', 'delicious', 'coffee']","['general', 'lee', 'special:', 'fruit', 'cup,', 'tomato', 'juice', 'soup,', 'half', 'southern', 'fried', 'chicken,', 'brown', 'gravy,', 'french', 'fried', 'potatoes,', 'cole', 'slaw,', 'home-made', 'rolls', 'butter,', 'pudding,', 'ice', 'cream', 'jello,', 'cup', 'delicious', 'coffee']","[('general', 'JJ'), ('lee', 'NN'), ('special:', 'NN'), ('fruit', 'NN'), ('cup,', 'NN'), ('tomato', 'NN'), ('juice', 'NN'), ('soup,', 'VBD'), ('half', 'JJ'), ('southern', 'JJ'), ('fried', 'VBN'), ('chicken,', 'NN'), ('brown', 'JJ'), ('gravy,', 'NN'), ('french', 'JJ'), ('fried', 'VBN'), ('potatoes,', 'JJ'), ('cole', 'JJ'), ('slaw,', 'NN'), ('home-made', 'NN'), ('rolls', 'NNS'), ('butter,', 'VBP'), ('pudding,', 'JJ'), ('ice', 'NN'), ('cream', 'NN'), ('jello,', 'NN'), ('cup', 'NN'), ('delicious', 'JJ'), ('coffee', 'NN')]",29.0,34.0,"'general', 'lee', 'special:', 'fruit', 'cup,', 'tomato', 'juice', 'soup,', 'half', 'southern', 'fried', 'chicken,', 'brown', 'gravy,', 'french', 'fried', 'potatoes,', 'cole', 'slaw,', 'home-made', 'rolls', 'butter,', 'pudding,', 'ice', 'cream', 'jello,', 'cup', 'delicious', 'coffee'",general lee special fruit cup tomato juice soup half southern fried chicken brown gravy french fried potatoes cole slaw homemade rolls butter pudding ice cream jello cup delicious coffee,1950,2.225
56,985446,28408,,,1958-09-18,Chickland,4,94,"de luxe lobster dinner: choice of soup, tomato juice or fruit cup, baked stuffed lobster (pound and one-quarter), drawn butter, french fried potatoes, green peas, home-made rolls and butter, pudding, ice cream or jello, a cup of delicious coffee.",324362.0,650708,52545,1,1,1958,1958,0.0,0.0,3.0,,"['de', 'luxe', 'lobster', 'dinner:', 'choice', 'of', 'soup,', 'tomato', 'juice', 'or', 'fruit', 'cup,', 'baked', 'stuffed', 'lobster', '(pound', 'and', 'one-quarter),', 'drawn', 'butter,', 'french', 'fried', 'potatoes,', 'green', 'peas,', 'home-made', 'rolls', 'and', 'butter,', 'pudding,', 'ice', 'cream', 'or', 'jello,', 'a', 'cup', 'of', 'delicious', 'coffee.']","['de', 'luxe', 'lobster', 'dinner:', 'choice', 'soup,', 'tomato', 'juice', 'fruit', 'cup,', 'baked', 'stuffed', 'lobster', '(pound', 'one-quarter),', 'drawn', 'butter,', 'french', 'fried', 'potatoes,', 'green', 'peas,', 'home-made', 'rolls', 'butter,', 'pudding,', 'ice', 'cream', 'jello,', 'cup', 'delicious', 'coffee.']","[('de', 'IN'), ('luxe', 'FW'), ('lobster', 'NN'), ('dinner:', 'NN'), ('choice', 'NN'), ('soup,', 'NN'), ('tomato', 'NN'), ('juice', 'NN'), ('fruit', 'NN'), ('cup,', 'NN'), ('baked', 'VBD'), ('stuffed', 'JJ'), ('lobster', 'NN'), ('(pound', 'IN'), ('one-quarter),', 'JJ'), ('drawn', 'NN'), ('butter,', 'NN'), ('french', 'JJ'), ('fried', 'VBN'), ('potatoes,', 'NN'), ('green', 'JJ'), ('peas,', 'NN'), ('home-made', 'NN'), ('rolls', 'NNS'), ('butter,', 'VBP'), ('pudding,', 'JJ'), ('ice', 'NN'), ('cream', 'NN'), ('jello,', 'NN'), ('cup', 'VBP'), ('delicious', 'JJ'), ('coffee.', 'NN')]",32.0,39.0,"'de', 'luxe', 'lobster', 'dinner:', 'choice', 'soup,', 'tomato', 'juice', 'fruit', 'cup,', 'baked', 'stuffed', 'lobster', '(pound', 'one-quarter),', 'drawn', 'butter,', 'french', 'fried', 'potatoes,', 'green', 'peas,', 'home-made', 'rolls', 'butter,', 'pudding,', 'ice', 'cream', 'jello,', 'cup', 'delicious', 'coffee.'",de luxe lobster dinner choice soup tomato juice fruit cup baked stuffed lobster pound onequarter drawn butter french fried potatoes green peas homemade rolls butter pudding ice cream jello cup delicious coffee,1950,2.225
57,991958,28483,,,1986-01-01,Old Lyme Inn,3,28,breast of chicken stuffed with a veal and watercress mousse and served on a watercress cream sauce,252851.0,672813,52793,1,1,1986,1986,0.0,0.0,15.5,,"['breast', 'of', 'chicken', 'stuffed', 'with', 'a', 'veal', 'and', 'watercress', 'mousse', 'and', 'served', 'on', 'a', 'watercress', 'cream', 'sauce']","['breast', 'chicken', 'stuffed', 'veal', 'watercress', 'mousse', 'served', 'watercress', 'cream', 'sauce']","[('breast', 'NN'), ('chicken', 'NN'), ('stuffed', 'VBD'), ('veal', 'JJ'), ('watercress', 'NN'), ('mousse', 'NN'), ('served', 'VBD'), ('watercress', 'JJ'), ('cream', 'NN'), ('sauce', 'NN')]",10.0,17.0,"'breast', 'chicken', 'stuffed', 'veal', 'watercress', 'mousse', 'served', 'watercress', 'cream', 'sauce'",breast chicken stuffed veal watercress mousse served watercress cream sauce,1980,11.5
58,996401,28554,,,1957-08-06,Virdan Restaurant,6,134,"virdan seafood platter, consisting of: fried shrimp, deep sea scallops, fillet fish sticks, deviled crab cake, lobster dainties, sauce tartare, cole slaw and french fried potatoes",266977.0,693466,53009,1,1,1957,1957,0.0,0.0,2.25,,"['virdan', 'seafood', 'platter,', 'consisting', 'of:', 'fried', 'shrimp,', 'deep', 'sea', 'scallops,', 'fillet', 'fish', 'sticks,', 'deviled', 'crab', 'cake,', 'lobster', 'dainties,', 'sauce', 'tartare,', 'cole', 'slaw', 'and', 'french', 'fried', 'potatoes']","['virdan', 'seafood', 'platter,', 'consisting', 'of:', 'fried', 'shrimp,', 'deep', 'sea', 'scallops,', 'fillet', 'fish', 'sticks,', 'deviled', 'crab', 'cake,', 'lobster', 'dainties,', 'sauce', 'tartare,', 'cole', 'slaw', 'french', 'fried', 'potatoes']","[('virdan', 'NN'), ('seafood', 'NN'), ('platter,', 'NN'), ('consisting', 'VBG'), ('of:', 'PRP'), ('fried', 'JJ'), ('shrimp,', 'JJ'), ('deep', 'JJ'), ('sea', 'NN'), ('scallops,', 'JJ'), ('fillet', 'NN'), ('fish', 'JJ'), ('sticks,', 'NN'), ('deviled', 'VBD'), ('crab', 'NN'), ('cake,', 'NN'), ('lobster', 'NN'), ('dainties,', 'NN'), ('sauce', 'NN'), ('tartare,', 'JJ'), ('cole', 'NN'), ('slaw', 'NN'), ('french', 'JJ'), ('fried', 'VBD'), ('potatoes', 'NNS')]",25.0,26.0,"'virdan', 'seafood', 'platter,', 'consisting', 'of:', 'fried', 'shrimp,', 'deep', 'sea', 'scallops,', 'fillet', 'fish', 'sticks,', 'deviled', 'crab', 'cake,', 'lobster', 'dainties,', 'sauce', 'tartare,', 'cole', 'slaw', 'french', 'fried', 'potatoes'",virdan seafood platter consisting of fried shrimp deep sea scallops fillet fish sticks deviled crab cake lobster dainties sauce tartare cole slaw french fried potatoes,1950,2.25
59,996915,28560,,,1957-10-10,Servis Buhl,3,149,"special sea food plate  fried breaded scallops, filet of sole, tartar sauce  fresh lobster and shrimp a la newburg, shoestring potatoes  combination salad, special dressing  coffee, tea or milk",247582.0,663036,53034,1,1,1957,1957,0.0,0.0,1.75,,"['special', 'sea', 'food', 'plate', 'fried', 'breaded', 'scallops,', 'filet', 'of', 'sole,', 'tartar', 'sauce', 'fresh', 'lobster', 'and', 'shrimp', 'a', 'la', 'newburg,', 'shoestring', 'potatoes', 'combination', 'salad,', 'special', 'dressing', 'coffee,', 'tea', 'or', 'milk']","['special', 'sea', 'food', 'plate', 'fried', 'breaded', 'scallops,', 'filet', 'sole,', 'tartar', 'sauce', 'fresh', 'lobster', 'shrimp', 'la', 'newburg,', 'shoestring', 'potatoes', 'combination', 'salad,', 'special', 'dressing', 'coffee,', 'tea', 'milk']","[('special', 'JJ'), ('sea', 'NN'), ('food', 'NN'), ('plate', 'NN'), ('fried', 'VBD'), ('breaded', 'VBN'), ('scallops,', 'JJ'), ('filet', 'NN'), ('sole,', 'NN'), ('tartar', 'NN'), ('sauce', 'NN'), ('fresh', 'JJ'), ('lobster', 'NN'), ('shrimp', 'NN'), ('la', 'NN'), ('newburg,', 'IN'), ('shoestring', 'VBG'), ('potatoes', 'NNS'), ('combination', 'NN'), ('salad,', 'VBP'), ('special', 'JJ'), ('dressing', 'VBG'), ('coffee,', 'NN'), ('tea', 'NN'), ('milk', 'NN')]",25.0,29.0,"'special', 'sea', 'food', 'plate', 'fried', 'breaded', 'scallops,', 'filet', 'sole,', 'tartar', 'sauce', 'fresh', 'lobster', 'shrimp', 'la', 'newburg,', 'shoestring', 'potatoes', 'combination', 'salad,', 'special', 'dressing', 'coffee,', 'tea', 'milk'",special sea food plate fried breaded scallops filet sole tartar sauce fresh lobster shrimp la newburg shoestring potatoes combination salad special dressing coffee tea milk,1950,1.75
60,999497,28598,,,1985-01-01,Hatsuhana,3,40,"sashimi, an assortment of thinly-sliced raw fish served with japanese wasabi (horseradish) & soy sauce. served with your choice of soup, sunomono, rice & japanese green tea",426951.0,657235,53196,1,1,1985,1985,12.0,12.0,12.0,,"['sashimi,', 'an', 'assortment', 'of', 'thinly-sliced', 'raw', 'fish', 'served', 'with', 'japanese', 'wasabi', '(horseradish)', '&', 'soy', 'sauce.', 'served', 'with', 'your', 'choice', 'of', 'soup,', 'sunomono,', 'rice', '&', 'japanese', 'green', 'tea']","['sashimi,', 'assortment', 'thinly-sliced', 'raw', 'fish', 'served', 'japanese', 'wasabi', '(horseradish)', '&', 'soy', 'sauce.', 'served', 'choice', 'soup,', 'sunomono,', 'rice', '&', 'japanese', 'green', 'tea']","[('sashimi,', 'JJ'), ('assortment', 'NN'), ('thinly-sliced', 'JJ'), ('raw', 'JJ'), ('fish', 'NN'), ('served', 'VBD'), ('japanese', 'JJ'), ('wasabi', 'NN'), ('(horseradish)', 'NNP'), ('&', 'CC'), ('soy', 'NN'), ('sauce.', 'NN'), ('served', 'VBD'), ('choice', 'NN'), ('soup,', 'NN'), ('sunomono,', 'NN'), ('rice', 'NN'), ('&', 'CC'), ('japanese', 'JJ'), ('green', 'JJ'), ('tea', 'NN')]",21.0,27.0,"'sashimi,', 'assortment', 'thinly-sliced', 'raw', 'fish', 'served', 'japanese', 'wasabi', '(horseradish)', '&', 'soy', 'sauce.', 'served', 'choice', 'soup,', 'sunomono,', 'rice', '&', 'japanese', 'green', 'tea'",sashimi assortment thinlysliced raw fish served japanese wasabi horseradish  soy sauce served choice soup sunomono rice  japanese green tea,1980,12.285714285714286
61,999498,28598,,,1985-01-01,Hatsuhana,3,40,"all japan, our combination lunch of nova scotia salmon grilled in our own special teriyaki sauce & 4 sushi. served with your choice of soup, sunomono, rice & japanese green tea",426948.0,657236,53196,1,1,1985,1985,12.0,12.0,12.0,,"['all', 'japan,', 'our', 'combination', 'lunch', 'of', 'nova', 'scotia', 'salmon', 'grilled', 'in', 'our', 'own', 'special', 'teriyaki', 'sauce', '&', '4', 'sushi.', 'served', 'with', 'your', 'choice', 'of', 'soup,', 'sunomono,', 'rice', '&', 'japanese', 'green', 'tea']","['japan,', 'combination', 'lunch', 'nova', 'scotia', 'salmon', 'grilled', 'special', 'teriyaki', 'sauce', '&', '4', 'sushi.', 'served', 'choice', 'soup,', 'sunomono,', 'rice', '&', 'japanese', 'green', 'tea']","[('japan,', 'NN'), ('combination', 'NN'), ('lunch', 'NN'), ('nova', 'JJ'), ('scotia', 'NN'), ('salmon', 'NN'), ('grilled', 'VBD'), ('special', 'JJ'), ('teriyaki', 'NN'), ('sauce', 'NN'), ('&', 'CC'), ('4', 'CD'), ('sushi.', 'NN'), ('served', 'VBD'), ('choice', 'NN'), ('soup,', 'NN'), ('sunomono,', 'NN'), ('rice', 'NN'), ('&', 'CC'), ('japanese', 'JJ'), ('green', 'JJ'), ('tea', 'NN')]",22.0,31.0,"'japan,', 'combination', 'lunch', 'nova', 'scotia', 'salmon', 'grilled', 'special', 'teriyaki', 'sauce', '&', '4', 'sushi.', 'served', 'choice', 'soup,', 'sunomono,', 'rice', '&', 'japanese', 'green', 'tea'",japan combination lunch nova scotia salmon grilled special teriyaki sauce   sushi served choice soup sunomono rice  japanese green tea,1980,12.285714285714286
62,999499,28598,,,1985-01-01,Hatsuhana,3,40,"fish teriyaki, fresh nova scotia salmon grilled in our own special teriyaki sauce. served with your choice of soup, sunomono, rice & japanese green tea",426949.0,657237,53196,1,1,1985,1985,12.0,12.0,12.0,,"['fish', 'teriyaki,', 'fresh', 'nova', 'scotia', 'salmon', 'grilled', 'in', 'our', 'own', 'special', 'teriyaki', 'sauce.', 'served', 'with', 'your', 'choice', 'of', 'soup,', 'sunomono,', 'rice', '&', 'japanese', 'green', 'tea']","['fish', 'teriyaki,', 'fresh', 'nova', 'scotia', 'salmon', 'grilled', 'special', 'teriyaki', 'sauce.', 'served', 'choice', 'soup,', 'sunomono,', 'rice', '&', 'japanese', 'green', 'tea']","[('fish', 'JJ'), ('teriyaki,', 'NN'), ('fresh', 'JJ'), ('nova', 'JJ'), ('scotia', 'NN'), ('salmon', 'NN'), ('grilled', 'VBD'), ('special', 'JJ'), ('teriyaki', 'NN'), ('sauce.', 'NN'), ('served', 'VBD'), ('choice', 'NN'), ('soup,', 'NN'), ('sunomono,', 'NN'), ('rice', 'NN'), ('&', 'CC'), ('japanese', 'JJ'), ('green', 'JJ'), ('tea', 'NN')]",19.0,25.0,"'fish', 'teriyaki,', 'fresh', 'nova', 'scotia', 'salmon', 'grilled', 'special', 'teriyaki', 'sauce.', 'served', 'choice', 'soup,', 'sunomono,', 'rice', '&', 'japanese', 'green', 'tea'",fish teriyaki fresh nova scotia salmon grilled special teriyaki sauce served choice soup sunomono rice  japanese green tea,1980,12.285714285714286
63,999510,28598,,,1985-01-01,Hatsuhana,3,40,"fish teriyaki, fresh japanese yellowtail grilled in our own special teriyaki sauce. served with your choice of soup, sunomono, rice & japanese green tea",426950.0,657370,53196,1,1,1985,1985,12.0,12.0,12.0,,"['fish', 'teriyaki,', 'fresh', 'japanese', 'yellowtail', 'grilled', 'in', 'our', 'own', 'special', 'teriyaki', 'sauce.', 'served', 'with', 'your', 'choice', 'of', 'soup,', 'sunomono,', 'rice', '&', 'japanese', 'green', 'tea']","['fish', 'teriyaki,', 'fresh', 'japanese', 'yellowtail', 'grilled', 'special', 'teriyaki', 'sauce.', 'served', 'choice', 'soup,', 'sunomono,', 'rice', '&', 'japanese', 'green', 'tea']","[('fish', 'JJ'), ('teriyaki,', 'NN'), ('fresh', 'JJ'), ('japanese', 'JJ'), ('yellowtail', 'NN'), ('grilled', 'VBD'), ('special', 'JJ'), ('teriyaki', 'NN'), ('sauce.', 'NN'), ('served', 'VBD'), ('choice', 'NN'), ('soup,', 'NN'), ('sunomono,', 'NN'), ('rice', 'NN'), ('&', 'CC'), ('japanese', 'JJ'), ('green', 'JJ'), ('tea', 'NN')]",18.0,24.0,"'fish', 'teriyaki,', 'fresh', 'japanese', 'yellowtail', 'grilled', 'special', 'teriyaki', 'sauce.', 'served', 'choice', 'soup,', 'sunomono,', 'rice', '&', 'japanese', 'green', 'tea'",fish teriyaki fresh japanese yellowtail grilled special teriyaki sauce served choice soup sunomono rice  japanese green tea,1980,12.285714285714286
